call_id,conversation
201,"Agent: Thank you for calling Maple Bank's Business Checking, this is Michael speaking. How can I assist? Customer: Hi Michael, I need to order checks for my business account. Agent: I can help with that. First, let's verify your account - can you confirm the business name and last four digits? Customer: Wilson Consulting, account ends with 6677. Agent: Thank you. For security, what was your approximate average monthly balance last quarter? Customer: Around $25,000. Agent: Verified. We offer several business check designs starting at $25 per box. Would you like me to email you samples? Customer: No, just the standard checks are fine. Agent: I've processed your order for 200 standard checks. They'll arrive within 7-10 business days."
202,"Agent: Maple Bank's Fraud Prevention, this is Sarah speaking. How may I help? Customer: Hello Sarah, I just got an alert about a suspicious charge on my debit card. Agent: I understand your concern. Let's verify your account - last four digits please? Customer: 7788. Agent: Thank you. For security, can you confirm your most recent ATM withdrawal? Customer: $100 at the grocery store yesterday. Agent: Verified. I see a $287 charge at an electronics store in another state - was this you? Customer: No, I didn't make that purchase. Agent: I've blocked the card and reversed the charge. A replacement will arrive within 5-7 business days."
203,"Agent: Good morning, Maple Bank's Credit Card Services, this is David speaking. How can I help? Customer: Hi David, I want to dispute a charge on my credit card statement. Agent: I can assist with that. First, let's verify your account - last four digits please? Customer: 8899. Agent: Thank you. For security, what was the amount of your last payment? Customer: $500 on the 15th. Agent: Verified. Which charge would you like to dispute and why? Customer: The $89 charge from Cloud Services on June 5th - I canceled that subscription. Agent: I've initiated the dispute process. You'll receive temporary credit within 3 business days while we investigate."
204,"Agent: Thank you for calling Maple Bank's Loan Servicing, this is Jessica speaking. How may I assist? Customer: Hello Jessica, I need my auto loan payoff amount. Agent: I can provide that information. First, let's verify your loan - last four digits please? Customer: 9900. Agent: Thank you. For security, can you confirm your vehicle make and model? Customer: Toyota Camry. Agent: Verified. As of today, your payoff amount is $12,345.67. Would you like me to email an official payoff letter? Customer: Yes please. Agent: I've sent the payoff letter to your email. This amount is valid for 10 business days."
205,"Agent: Maple Bank's Online Banking Support, this is Ryan speaking. How can I help? Customer: Hi Ryan, I'm locked out of my online banking account. Agent: I can help reset your access. First, let's verify your identity - last four digits please? Customer: 0011. Agent: Thank you. For security, what was your last bill payment amount? Customer: $150 to the electric company. Agent: Verified. I'll send a password reset link to your email. Please create a strong, unique password. Customer: Got it, thanks. Agent: You're all set. I recommend setting up two-factor authentication for extra security. Would you like me to explain how?"
206,"Agent: Good afternoon, Maple Bank's Mortgage Department, this is Emily speaking. How may I help? Customer: Hello Emily, I want to check current mortgage rates. Agent: I'd be happy to help. First, let's verify your account - last four digits please? Customer: 1122. Agent: Thank you. For security, what's your approximate credit score range? Customer: Around 750. Agent: Verified. Current rates for 30-year fixed mortgages start at 6.25% APR. Would you like a personalized quote based on your specific situation? Customer: Yes please. Agent: I'll connect you with one of our mortgage specialists who can provide detailed options. Please hold for just a moment."
207,"Agent: Thank you for calling Maple Bank's Business Credit, this is Mark speaking. How can I assist? Customer: Hi Mark, I need to add an authorized user to my business credit card. Agent: I can help with that. First, let's verify your account - business name and last four digits please? Customer: Smith & Co, card ends with 2233. Agent: Thank you. For security, what's your monthly spending limit? Customer: $10,000. Agent: Verified. What's the employee's full name and what spending limit would you like to set? Customer: John Wilson, with a $2,500 limit. Agent: I've added the authorized user. The card will arrive at your business address within 7-10 business days."
208,"Agent: Maple Bank's Trust Services, this is Laura speaking. How may I help? Customer: Hello Laura, I'm a beneficiary and have questions about my distribution. Agent: I can assist with that. First, let's verify the trust - last four digits please? Customer: 3344. Agent: Thank you. For security, can you name the trustee? Customer: Robert Johnson. Agent: Verified. According to the trust documents, you receive quarterly distributions. The next payment is scheduled for July 1st. Customer: What's the amount? Agent: The distribution amount is $5,000 per quarter. Would you like me to email you the payment schedule?"
209,"Agent: Good morning, Maple Bank's International Banking, this is Kevin speaking. How can I help? Customer: Hi Kevin, I need to send money to my son studying abroad. Agent: I can assist with international transfers. First, let's verify your account - last four digits please? Customer: 4455. Agent: Thank you. For security, what was your last international transfer amount? Customer: $1,000 to the UK last month. Agent: Verified. Today's exchange rate is 1.12 USD to EUR. The $2,000 transfer will cost $2,240 plus $40 fee. Would you like to proceed? Customer: Yes please. Agent: Transfer completed. The funds will arrive in 1-2 business days. I've emailed you confirmation."
210,"Agent: Thank you for calling Maple Bank's Customer Service, this is Nicole speaking. How may I help? Customer: Hello Nicole, I need to update my mailing address. Agent: I can assist with that. First, let's verify your identity - last four digits please? Customer: 5566. Agent: Thank you. For security, what's your current address on file? Customer: 123 Main Street. Agent: Verified. What's your new address? Customer: 456 Oak Avenue. Agent: I've updated your address in our system. The change is effective immediately. Would you like me to confirm any other account details?"
